{
  "run_id": "2026-06-08_v0_naive_claude_seed010",
  "method": "v0_naive_claude",
  "seed": 10,
  "is_smoke_test": true,
  "budget": "cheap_smoke",
  "schema_valid": true,
  "xdsl_files": 0,
  "xdsl_op_estimate": 0,
  "pass_tests_pass": null,
  "pass_tests_total": null,
  "evidence_coverage": null,
  "unsupported_claim_rate": null,
  "arch_rules_passed": 8,
  "arch_rules_failed": 2,
  "human_interventions": null,
  "cost_usd": null,
  "time_to_first_pass_s": null,
  "heldout_shape_success": null,
  "merlin_core_files_modified": null,
  "tracking_mode": "local",
  "mlflow_run_id": null,
  "otel_trace_id": null,
  "observed_cost_usd": null,
  "estimated_cost_usd": null,
  "cost_source": null,
  "tokens_input": null,
  "tokens_output": null,
  "token_source": null,
  "wall_clock_seconds": 0.037,
  "time_to_first_validation_s": null,
  "agent_turns": null,
  "tool_calls": null
}
